{
  "$schema": "https://json-schema.org/draft/2020-12/schema",
  "$id": "repo://contracts/agt002-radar-reliability/v1/promotion-bundle.schema.json",
  "title": "AGT-002 M1 radar reliability promotion bundle",
  "description": "Bundle atómico y cerrado consumido por validateAgt002M1RadarReliabilityBundle / resolveAgt002M1RadarReliabilityPromotion: todas las propiedades son requeridas y ningún objeto (a ningún nivel) admite propiedades adicionales, en espejo exacto de las formas cerradas (closedShape) del evaluador.",
  "type": "object",
  "required": ["schema_version", "run_id", "scan", "persistence", "ui_projection", "evidence", "freshness"],
  "additionalProperties": false,
  "properties": {
    "schema_version": { "const": "agt002-m1-radar-reliability-v1" },
    "run_id": { "type": "string", "minLength": 1 },
    "scan": { "$ref": "#/$defs/scan" },
    "persistence": { "$ref": "#/$defs/persistence" },
    "ui_projection": { "$ref": "#/$defs/ui_projection" },
    "evidence": {
      "type": "array",
      "items": { "$ref": "#/$defs/evidence_item" }
    },
    "freshness": { "$ref": "#/$defs/freshness" }
  },
  "$defs": {
    "scan": {
      "type": "object",
      "required": [
        "status",
        "started_at_utc",
        "completed_at_utc",
        "pagination",
        "source_snapshot_hash",
        "item_count"
      ],
      "additionalProperties": false,
      "properties": {
        "status": { "type": "string", "minLength": 1 },
        "started_at_utc": { "$ref": "#/$defs/rfc3339_utc" },
        "completed_at_utc": { "$ref": "#/$defs/rfc3339_utc" },
        "pagination": { "$ref": "#/$defs/pagination" },
        "source_snapshot_hash": { "$ref": "#/$defs/hash64" },
        "item_count": { "type": "integer", "minimum": 0 }
      }
    },
    "pagination": {
      "type": "object",
      "required": ["pages_fetched", "total_pages_declared", "exhaustive", "claims_absence"],
      "additionalProperties": false,
      "properties": {
        "pages_fetched": { "type": "integer", "minimum": 0 },
        "total_pages_declared": { "type": "integer", "minimum": 0 },
        "exhaustive": { "type": "boolean" },
        "claims_absence": { "type": "boolean" }
      }
    },
    "persistence": {
      "type": "object",
      "required": ["persisted_count", "persisted_snapshot_hash", "persisted_at_utc"],
      "additionalProperties": false,
      "properties": {
        "persisted_count": { "type": "integer", "minimum": 0 },
        "persisted_snapshot_hash": { "$ref": "#/$defs/hash64" },
        "persisted_at_utc": { "$ref": "#/$defs/rfc3339_utc" }
      }
    },
    "ui_projection": {
      "type": "object",
      "required": ["rendered_count", "rendered_snapshot_hash", "rendered_at_utc"],
      "additionalProperties": false,
      "properties": {
        "rendered_count": { "type": "integer", "minimum": 0 },
        "rendered_snapshot_hash": { "$ref": "#/$defs/hash64" },
        "rendered_at_utc": { "$ref": "#/$defs/rfc3339_utc" }
      }
    },
    "evidence_item": {
      "type": "object",
      "required": ["evidence_id", "kind", "locator", "captured_at_utc", "content_sha256"],
      "additionalProperties": false,
      "properties": {
        "evidence_id": { "type": "string", "minLength": 1 },
        "kind": { "type": "string", "minLength": 1 },
        "locator": { "$ref": "#/$defs/locator" },
        "captured_at_utc": { "$ref": "#/$defs/rfc3339_utc" },
        "content_sha256": { "$ref": "#/$defs/hash64" }
      }
    },
    "freshness": {
      "type": "object",
      "required": ["now_utc", "data_as_of_utc", "max_staleness_calendar_days"],
      "additionalProperties": false,
      "properties": {
        "now_utc": { "$ref": "#/$defs/rfc3339_utc" },
        "data_as_of_utc": { "$ref": "#/$defs/rfc3339_utc" },
        "max_staleness_calendar_days": { "type": "integer", "minimum": 0 }
      }
    },
    "hash64": {
      "type": "string",
      "pattern": "^[0-9a-fA-F]{64}$"
    },
    "locator": {
      "type": "string",
      "pattern": "^(fixture|repo|evidence)://"
    },
    "rfc3339_utc": {
      "type": "string",
      "pattern": "^(\\d{4})-(\\d{2})-(\\d{2})T(\\d{2}):(\\d{2}):(\\d{2})(?:\\.\\d{1,9})?Z$"
    }
  }
}
